{"candidate":{"candidate_artifact_digest":"sha256:1725027b73270b1377b3ca99a0f0ff387a9688c2e752e250653d527e2c0e2da6","candidate_artifact_id":9300000001,"candidate_run_attempt":1,"candidate_run_id":31900000001,"expected_peeled_commit_sha":"2222222222222222222222222222222222222222","schema":"dpone.release-candidate-stream-request.v1","schema_version":1,"tag":"v0.74.0"},"evidence":{"candidate_artifact_broker_request_id":"request-01HXDPONE","candidate_artifact_created_at":"2026-08-15T00:00:00Z","candidate_artifact_expanded_bytes":11719,"candidate_artifact_expires_at":"2026-08-16T00:00:00Z","candidate_artifact_file_count":25,"candidate_artifact_policy_blob_sha":"6666666666666666666666666666666666666666","candidate_artifact_policy_sha256":"sha256:4444444444444444444444444444444444444444444444444444444444444444","candidate_artifact_provider_api_version":"2026-03-10","candidate_artifact_provider_metadata_schema":"dpone.github-actions-artifact-observation.v1","candidate_artifact_provider_observation_sha256":"sha256:1880c9f5c0a3b201ebe22823aa32b100f3d160782df43188ad6d1f22c5a341b6","candidate_artifact_provider_response_sha256":"sha256:8888888888888888888888888888888888888888888888888888888888888888","candidate_artifact_raw_zip_sha256":"sha256:1725027b73270b1377b3ca99a0f0ff387a9688c2e752e250653d527e2c0e2da6","candidate_artifact_raw_zip_size_bytes":15735,"candidate_artifact_source_url_expires_at":"2026-08-15T00:01:00Z","candidate_artifact_source_url_sha256":"sha256:7777777777777777777777777777777777777777777777777777777777777777","candidate_artifact_tag_object_sha":"1111111111111111111111111111111111111111","candidate_id":"sha256:9cc7cfd081e05d80233e41ffc15f8297635d188d4e483c72f92ab00a6a126c3c","candidate_inventory_sha256":"sha256:79cbc50da873b5af695db96a8e2ee1be928eea9e9e59f44658dec08f29cf0d66","candidate_manifest_sha256":"sha256:50da789b7cca52acf6674beb05163a2277592000eccc80272e0449cd29e3fb29","candidate_reader_deployment_observation_record_id":"sha256:8888888888888888888888888888888888888888888888888888888888888888","candidate_reader_deployment_observation_record_sha256":"sha256:9999999999999999999999999999999999999999999999999999999999999999","candidate_reader_service_identity":"cloudflare-worker:account-01/dpone-release-candidate-reader@candidate-reader-version-01","candidate_reader_service_version_id":"candidate-reader-version-01","distribution_inventory":[{"filename":"apache_airflow_providers_dpone-0.74.0-py3-none-any.whl","project":"apache-airflow-providers-dpone","sha256":"sha256:d324ca897f502fe0dd46525e9ce0501f11e4790c0ac192335553f57b336164e4","size_bytes":280,"version":"0.74.0"},{"filename":"apache_airflow_providers_dpone-0.74.0.tar.gz","project":"apache-airflow-providers-dpone","sha256":"sha256:33e1103d26803292f5bf68c366ea9de522a3119d6c98e7241d690af8aa694e67","size_bytes":203,"version":"0.74.0"},{"filename":"dpone-0.74.0-py3-none-any.whl","project":"dpone","sha256":"sha256:fe4fca63ae0323237a3c547a06264debcf1b61d7797b64e41492d92b040136fa","size_bytes":206,"version":"0.74.0"},{"filename":"dpone-0.74.0.tar.gz","project":"dpone","sha256":"sha256:2c95966d2ea6d83b46b0221dd74e6065af2d4ec39dd22ca8a67e798ef3a2814b","size_bytes":172,"version":"0.74.0"},{"filename":"dpone_airflow_pack-0.74.0-py3-none-any.whl","project":"dpone-airflow-pack","sha256":"sha256:3bea0fd3e34ff60c97f4c8228e0274956aee8aab3cf65afaa723f46b22a29b1c","size_bytes":245,"version":"0.74.0"},{"filename":"dpone_airflow_pack-0.74.0.tar.gz","project":"dpone-airflow-pack","sha256":"sha256:1a6cf5c91710808612ab7c13344644d1faec8f7419eefcd98e526ea5a4867986","size_bytes":191,"version":"0.74.0"},{"filename":"dpone_native_accel-0.74.0-py3-none-any.whl","project":"dpone-native-accel","sha256":"sha256:6b63f795f3ad890bb7f5bc0216325acd3186586d9ab88797c9ea9f72b831e486","size_bytes":245,"version":"0.74.0"},{"filename":"dpone_native_accel-0.74.0.tar.gz","project":"dpone-native-accel","sha256":"sha256:e80bfc9088cf73477571c9050957c004e7fc65d8b7fee8338b52978087198f00","size_bytes":189,"version":"0.74.0"}],"distribution_inventory_sha256":"sha256:cc023e4f269ebc3ea87e4cdba187231a97238183a78ae305204fa64c06006767","file_count":25,"total_bytes":11719},"provider_observation":{"artifact_created_at":"2026-08-15T00:00:00Z","artifact_digest":"sha256:1725027b73270b1377b3ca99a0f0ff387a9688c2e752e250653d527e2c0e2da6","artifact_expired":false,"artifact_expires_at":"2026-08-16T00:00:00Z","artifact_id":9300000001,"artifact_name":"release-candidates","artifact_size_bytes":15735,"broker_request_id":"request-01HXDPONE","candidate_reader_deployment_observation_record_id":"sha256:8888888888888888888888888888888888888888888888888888888888888888","candidate_reader_deployment_observation_record_sha256":"sha256:9999999999999999999999999999999999999999999999999999999999999999","candidate_reader_service_identity":"cloudflare-worker:account-01/dpone-release-candidate-reader@candidate-reader-version-01","candidate_reader_service_version_id":"candidate-reader-version-01","conclusion":"success","event":"push","head_branch":"v0.74.0","head_sha":"2222222222222222222222222222222222222222","policy_blob_sha":"6666666666666666666666666666666666666666","policy_path":".agents/policy/github-branch-protection.yml","policy_sha256":"sha256:4444444444444444444444444444444444444444444444444444444444444444","policy_source_commit_sha":"2222222222222222222222222222222222222222","provider_api_version":"2026-03-10","provider_response_sha256":"sha256:8888888888888888888888888888888888888888888888888888888888888888","release":"v0.74.0","repository":"PaulKov/dpone","repository_id":1255975556,"run_attempt":1,"run_id":31900000001,"run_status":"completed","schema":"dpone.github-actions-artifact-observation.v1","schema_version":1,"source_url_expires_at":"2026-08-15T00:01:00Z","source_url_sha256":"sha256:7777777777777777777777777777777777777777777777777777777777777777","tag_object_sha":"1111111111111111111111111111111111111111","tag_object_type":"tag","tag_ref":"refs/tags/v0.74.0","workflow_path":".github/workflows/release.yml"},"release_identity_id":"sha256:3d52af3a2bc6eb185a48465c8680d988a57f7fecf668313673ded1aaed3a59ab","schema":"dpone.release-controller-candidate-admit-request.v1","schema_version":1}